,title,url,date,score,n_comments,body
0,[Humor] There's two kinds of people...,https://pbs.twimg.com/media/CzBMy_bUQAAFdL_.jpg,1481166995.0,37510,1467,
1,Reddit bans r/whalewatching thinking its a clone of r/fatpeoplehate. It was actually a real attempt at a whale watching community and has existed for +2 years.,https://archive.is/nsZKC,1434062071.0,34286,1838,
2,[CENSORSHIP] The new age of reddit has begun. Admins ban /r/FatPeopleHate (and 4 other subreddits that the admins fail to disclose).,https://archive.is/zRix7,1433988483.0,26544,2666,
3,Pussy Pass Denied mods are being threatened with doxxing if they don't hand over the sub over to SJWs to shut down. One mod has already lost their job.,http://web.archive.org/web/20170207132914/https://www.reddit.com/r/pussypassdenied/comments/5rzlpx/update_to_the_doxing_situation/,1486503102.0,25259,1737,
4,[Censorship]Youtube cuts ad revenue for Phillip Defranco for posting Annaliese Nielsen video,https://twitter.com/PhillyD/status/771037634713952256,1472702462.0,17983,1614,
5,"Ellen Pao to NYT: ""the most virulent detractors on the site are a vocal minority, and that the vast majority of Reddit users are uninterested in what unfolded over the past 48 hours.""",http://www.nytimes.com/2015/07/04/technology/reddit-moderators-shut-down-parts-of-site-over-executives-dismissal.html?hp&action=click&pgtype=Homepage&module=second-column-region&region=top-news&WT.nav=top-news,1436008175.0,17770,1850,
6,[CENSORSHIP] Admins caught editing posts in /r/The_Donald,https://archive.is/A6EGv,1479973885.0,15817,1176,
7,CNN discovers more evidence of Russian hacking,https://i.redd.it/xtz9smtlsi7y.jpg,1483488106.0,15614,699,
8,Cyanide & Happiness animator nails the Fine Bros drama,https://i.imgur.com/fVZQwrO.png,1454278127.0,14527,365,
9,Delta Airline confirms that Adam Saleh was not kicked off a flight for speaking Arabic. He was kicked out for shouting and bothering passengers. The media owes Delta an apology,http://lawnewz.com/politics/delta-concludes-after-interviewing-multiple-witnesses-that-youtube-prankster-was-actually-shouting-disruptive/,1482403304.0,14236,640,
10,"100,000 people have now signed the change.org petition, requesting that Ellen ""From my cold, dead hands"" Pao step down as CEO of Reddit Inc.",http://www.change.org/p/ellen-k-pao-step-down-as-ceo-of-reddit-inc,1436069458.0,12283,755,
11,"Yale girl who screamed at professor, ""who the fuck hired you!?"" served on search committee that hired professor.",http://news.yale.edu/2015/02/26/nicholas-christakis-be-next-master-silliman-college,1447223785.0,12166,994,
12,Ashley Lynch can dish it but can't take it,https://i.redd.it/koyuo9to3eby.jpg,1485174683.0,11616,1173,
13,"reddit hard bans all OP links to slimgur, the image host announced recently as a competitor to imgur due to imgur's political/ideological censorship of fat criticism images. imgur and reddit have common investors.",https://www.reddit.com/r/KotakuInAction/comments/39nang/reddit_hard_bans_all_op_links_to_slimgur_the/,1434180672.0,11611,1277,"Evidence of common investors:

> today it announced a $40 million funding round from Andreessen Horowitz and Reddit, its first outside investment, to continue its astounding growth.

Source: http://pando.com/2014/04/03/imgur-raises-40-million-from-andreessen-horowitz-and-reddit/

Evidence of hard ban:

http://i.imgur.com/2fumOoX.png

OPs *and comments* (newly discovered) containing slimgur links are automatically removed and can't even be approved by moderators.

imgur was created by a redditor who saw an opportunity in the market and filled it, but reddit is currently blocking slimgur from doing the same.

Edit: We're getting inconsistent results from various subreddits and testing is underway.

Edit 2: Results used to be inconsistent across subs as follows, to the best of my knowledge: slimgur links were auto-removed on all subs, but some subs could approve them, while others couldn't (hard bans). The subs with hard bans seem to have been manually picked, including KiA. Per /u/AntithesisD's update (he's a mod here) as of a few hours ago, all hard bans have been lifted. Soft bans remain in effect. Per my tests, the bans go in and out of effect. The admins may be turning the bans on and off to spread conflicting results and reactions, and thereby diffuse the protest. Feel free to submit slimgur links on subs you mod, and test whether they're auto-removed and can be approved. Here are test images, fix the URLs, obviously.

http://www.slim*gur.com/images/2015/06/11/HlrjH3c.jpg

http://www.slim*gur.com/image/G0"
14,"[humor] there is an extension that just came out that changes the word white to black. i installed it and looked up the usual suspects (Salon, Gawker, HuffPo) it really shows you how fucked up their articles are and is really funny",https://i.redd.it/pfq096lpp8hy.jpg,1487724634.0,11471,635,
15,"Chairman Pao just banned /r/fatpersonhate and /r/fatpeoplehate3 for ""ban evasion"" - as if they were already ""harassing"", ergo: banning ideas instead of behavior!",https://archive.is/eCSDq,1434011234.0,11464,557,
16,"Ken Bone, the media's victim of the week, once posted this to a rape victim. This is the man the media chose to turn into a monster.",https://twitter.com/stillgray/status/787178872471101440,1476562089.0,11397,552,
17,"User banned from /r/Planetside after using a meme which involved the word ""trap"" and is forced to submit a 500 line of text essay on the impact of transphobia in America in order for the ban to be lifted.",http://i.imgur.com/nlpUQQM.png,1433783121.0,11167,2663,
18,/r/all : I encourage you to unsubscribe from /r/news,https://www.reddit.com/r/KotakuInAction/comments/4nr4vz/rall_i_encourage_you_to_unsubscribe_from_rnews/,1465779702.0,10965,429,"For the past several years, the administrators of reddit have been complicit in creating a site with heavily curated content. For reddit as a company, this represents the interests of their investors: they believe there is more money to be made in moving away from the website's original goal of providing a place where free-speech is encouraged and dissent is allowed. Jaded 16-25 year olds with libertarian tendencies just don't spend enough money.

But what we have in /r/news' censoring of the mass shooting in Orlando is worse. This fits the general trend of reddit providing a feel good arena for mass advertising, but has a different motive. To my knowledge, the moderating team of /r/news is not paid by reddit or any third party to curate content. They could be, but there does not seem to be public evidence.

Rather, we have people squashing truth ""for the greater good"". The moderators of /r/news believe that by censoring content that could cast a particular group in a bad light, they are doing that group and the world a service. They are afraid of a public backlash against that group in retaliation. Not only are some of the moderators of /r/news members of that greater group, but they are also afraid that a specific US presidential candidate's campaign would benefit greatly from this news, and they really do not like him.

I don't think anybody is having trouble understanding the logic behind this. These moderators believe they are acting ""for the greater good"", and that ""the ends justify the means"". They truly believe they are doing the world a service.

What they don't realize is that they are overstepping their bounds. 

It's not their place to curate content because they don't like the news when that news is framed in a neutral setting (i.e., not ""this muslim committed a mass shooting, let's round up all the muslims and get our revenge). By running such a large subreddit on such a widely used website, there is an element of trust that the moderators would not push an agenda under some guise of ""this doesn't fit one of our extremely general rules"". You expect that /r/news would probably be a good source of news: it's widely subscribed and generally quite active.

The moderators of /r/news have betrayed our trust. You could say ""well if you don't like it, don't use it"". And that is exactly what we should do. We can't remove these moderators by any normal means, and calling for their removal by the reddit administration would get us nowhere (think of the dangerous precent that would set if it happened!). The best way to deal with this problem is to make sure everyone hears it, **and to not use /r/news until change has been enacted.**"
19,"To protest recent CEO/admin decisions following many years of CEO/admin mismanagement, July 10 has been suggested as a no reddit day. Find the details at /r/justsaynope.",https://www.reddit.com/r/KotakuInAction/comments/3c37ta/to_protest_recent_ceoadmin_decisions_following/,1436030492.0,10926,653,"Link for the lazy: /r/justsaynope

The idea is to not post or comment on reddit on Friday, July 10, preferably to not even browse the site. This is the minimum protest period. For an extra achievement, go through the entire three-day weekend period (Friday, Saturday, Sunday) without reddit if you can.

If every person that thought ""This will never happen!"" actually went along with it, it would happen.

If you need a reddit-like site to get you through the day or the weekend, [Voat](https://voat.co/) will probably be in service by then. [Snapzu](http://snapzu.com/) and [Hubski](https://hubski.com/) are also mentioned a lot as competent alternatives, though their UIs and feature sets are somewhat different. More alternatives are available for your consideration on /r/redditalternatives. And of course, [8chan](http://8ch.net/), though it looks and works quite different, has bandwidth to spare and can accomodate all of you many times over.

As for what July 10 means on an international site like reddit, the two most popular proposals are:

1. Everyone goes without reddit on the July 10 of their local time zone.
2. Everyone goes without reddit from 00:00 July 10 UTC until 00:00 July 11 UTC, which is from 8 PM July 9 Eastern until 8 PM July 10 Eastern, or 5 PM July 9 Pacific until 5 PM July 10 Pacific.

Discuss.

Edit: I made a countdown to 00:00 July 10 2015 UTC:

http://itsalmo.st/#noredditday2015_k8pqm

Once [the countdown](http://itsalmo.st/#noredditday2015_k8pqm) hits that timestamp, it will continue to count up from it, so you can use it to count up 24/48/72 hours, however long you want to protest. I think the whole three-day weekend period (Friday, Saturday, Sunday) would be great if you can stick to it. That would mean starting the protest when [the countdown](http://itsalmo.st/#noredditday2015_k8pqm) hits 0, and continuing for 72 hours. But even if you can't hold out for that long, do 24 hours at a minimum.

A good way to stick to the protest is to change the URL of your reddit browser bookmark (if you have one) with [the countdown](http://itsalmo.st/#noredditday2015_k8pqm). That way, every time you click on it, you will be reminded of how much longer you have to go. Other ways to resist the temptation include using site-blocking extensions or programs. [Here are some good options](http://techpp.com/2011/06/09/block-distracting-websites/), but there are many more, feel free to do your own research.

Edit 2: We are being brigaded by SJWs even moreso than usual. Be especially critical of disruptive points, and do your best to not lose your composure against provocation attempts. Feel free to report such attempts if they cross the line of personal attacks (Rule 1) or bad faith (Rule 3).

Edit 3: The post has frontpaged on /r/all.

Edit 4: Feel free to get the word out through as many channels as you can. Your options include privately messaging mods that you are on good terms with (and asking them to get the word out), tweeting with #NoRedditDay (paired with one or more of #AMAgeddon, #TheDarkening, and #RedditRevolt), posting on Facebook GamerGate group(s) you might be a member of, [as well as using any of the non-reddit channels listed here](/r/KotakuInAction/comments/3b519f/list_of_gamergate_discussion_hubs/). Feel free to propose other #GamerGate/#RedditRevolt-friendly channels via private message."
20,"Girl from my University claims to have been attacked by 2 white male trump Supporters, caused alot of local outrage. Later admits she made it up",http://klfy.com/2016/11/10/lafayette-pd-ul-student-made-up-story-about-attack-stolen-hijab/,1478840743.0,10850,440,
21,Wikileaks bringing the salt burn,https://i.reddituploads.com/be48745f63e345a4a9c922f02fcf294f?fit=max&h=1536&w=1536&s=bf7370ed4b713cfeb60a4cff64828548,1469166439.0,10069,658,
22,Congress confirms Reddit admins were trying to hide evidence of email tampering during Clinton trial.,https://www.youtube.com/watch?v=zQcfjR4vnTQ,1475138641.0,9967,879,
23,"Facebook declares Wikileaks links ""unsafe""",https://pbs.twimg.com/media/CoGDlFSUAAAV6C3.jpg:large,1469370591.0,9680,283,
24,"A joke making fun of Reddit CEO Ellen Pao is removed for ""harassment"" after receiving more than 3000 upvotes.",https://archive.is/iFq3A,1432614398.0,9335,795,
25,Black female student caught faking racism by creating KKK Twitter account and threatening black students,http://vesselnews.io/fake-hate-black-teen-behind-koolkidsklankkk-twitter-account-threatening-black-students/,1484272368.0,8862,438,
26,[Censorship] r/neogafinaction has just been banned. The sub didn't break any rules and was unrelated to neofag. Yet Admins banned it because it was critical of anti-GG forum neogaf,https://www.reddit.com/r/KotakuInAction/comments/39ent0/censorship_rneogafinaction_has_just_been_banned/,1434030230.0,8499,544,"This is fucking preposterous, check it out: /r/neogafinaction

 I even setup an automoderator removing direct links to reddit and neogaf. There is no fucking excuse for this BULLSHIT. Oh and btw, the sub was ~6 months old so they don't even have the excuse that I'm an alternative account that just created it to resurrect neofag."
27,"Gawker might have died, but its legacy lives on. The media's hate continues.",https://i.redd.it/eozsbyl3x0ux.jpg,1477605702.0,8505,791,
28,"Two identical tweets were posted on Twitter. One with ""I fucking hate white people"" and another changing white to black. Guess which account got suspended and which was ""not in violation of the community guidelines""?",http://voxday.blogspot.com/2016/11/equality.html?m=1,1479421149.0,8147,583,
29,Maddox with a perfect response!,http://imgur.com/v7P9JOU,1457232090.0,8147,655,
30,"Voat.co's provider, hosteurope.de, shuts down voat's servers due to ""political incorrectness""",https://voat.co/v/announcements/comments/146757,1434743485.0,8112,2180,
31,A simple test of Twitter's culture,https://i.sli.mg/2V7OlX.jpg,1479497861.0,7996,253,
32,The value of capturing SJW insanity on camera cannot be understated: that Lyft driver with the Hawaiian bobblehead got fired for a few days before Annaliese's video proved him innocent.,https://twitter.com/Lauren_Southern/status/770771973035155456,1472635568.0,7926,1121,
33,Video game designer Daniel Vávra is called racist by an SJW for not putting black people in a videogame about medieval Czech kingdom. Explains that this is because there were none. [X-post from /r/QuitYourBullshit],http://imgur.com/omnobVt,1462920510.0,7859,804,
34,Found this on /r/WTF,http://i.imgur.com/MAANNVB.png,1459512513.0,7670,492,
35,"This is going to rustle some asses. ""Ghostbusters"" has been nominated by the Razzies for ""Worst Screenplay""",https://www.reddit.com/r/KotakuInAction/comments/5ms299/this_is_going_to_rustle_some_asses_ghostbusters/,1483926688.0,7512,579,"https://www.comicbookmovie.com/batman_vs_superman/razzie-shortlists-revealed-for-2016-the-37th-golden-a147971

Because kek wills it."
