,0
808,[Ethics] Incredible dishonest cutting & editing of Jordan Petersons Vice interview
809,"[ethics] Bungie Hires head of /r/DestinyTheGame as CM, He steps down as head of the sub citing conflict of interest."
810,"[HUMOR] 70% upvoted r/AgainstHateSubreddits hate subs list include KotakuInAction,TumblrInAction,Shadbase,Drama,Jontron"
811,[CENSORSHIP] I'm just here for the bans. No need to upvote.
812,"TIL Wikipedia employed a convicted felon, as it's first Chief operating Officer having failed to carry out basic background checks. Her crimes span 4 states and include fraud, DUI hit & run and shooting her boyfriend. Upon her last arrest / firing, Wikipedia deleted their article about her."
813,"[Drama] The BBC reserves the right to snitch on people to their schools and employers for posting ""offensive, inappropriate or objectionable content"" on their website? (this is their latest Privacy and Cookies Policy)"
814,Mizzou protesters are ANGRY Paris terror attacks stole their MEDIA SPOTLIGHT! (Xpost TIA)
815,A 'Gator is Born
816,"[Censorship] Australian TV Show has Facebook remove video interview, regarding The Red Pill, which made them look bad."
817,"[SocJus] This billboard in Saskatoon, Saskatchewan, Canada was paid for by the City."
818,The hitpieces begin as VICE is disappointed that CDPR won't have multiple gender options into Cyberpunk 2077
819,ABC News is actively censoring the Youtube comments made in response to their yellow journalism about GamerGate
820,"TotalBiscuit on Gawker's Mein Kampf bot: ""We tried to code a bot that would take Gawker articles and turn them into journalism but it's beyond mankinds current technological ability"""
821,"[SOCJUS] So Graham Linehan, Leigh Alexander, and Jenn Frank are now showing how dedicated they are to anti harassment by laughing at how ugly a disabled GGer is"
822,A new low in Youtube's advertising hypocrisy
823,"Kotaku publish an article copy pasted from imgur that is in fact a translation of a French one, without credits to the original author."
824,There is currently a thread on r/soccer with 1100+ upvotes directly listing advertiser emails - something we were told explicitly was against the rules
825,"Youtuber The Masked Arab, an Ex-Muslim critical of extreme messages in Islam, got his channel taken down"
826,"[Censorship] /r/worldnews Remove Story of Transexuals Being ""Stoned"" by North Africans in Germany"
827,"[Twitter Bullshit] Notch - ""I've now manunderstood the c word is way more loaded in the us than I thought. I should've manused it less."" (honestly not sure if manpology or brotinuing to make fun)"
828,The canvas bag for Fallout 76 could actually cost about $5....
829,"[SocJus] Anon nails it on what SJWs really mean by ""diversity."" It's not about diversity, it's about control."
830,"[Twitter Bullshit] Mombot on Twitter: ""Remember when that UN child rights group demanded Japan ban manga? One of their chief advocates is now in jail for 5 counts of child rape."""
831,"The ""idea of control variables is incompatible with feminism, because control is a masculine value""."
832,"PSA: Destiny is not ""good at debating."""
833,"Wearing a safety pin used to have a different meaning back in the day, 4chan might have tricked the SJWs"
834,The SJPAirplay debate got evacuated after bomb threats
835,"The important thing about the Google lawsuit is not that employees said racist, sexist, intolerant things. It's that HR defended them."
836,Aspiring heart surgeon who stabbed boyfriend in England may avoid jail because she's 'extraordinary' [SocJus]
837,"Netflix showrunner outright lying to Witcher fans about the casting beforehand. ""I will not deviate from the book's races and cultures..."" - proceeds to cast several black (and one Indian) actors for white roles."
838,"[Censorship] Apparently Imam Tawhidi's message is too SENSITIVE for twitter - Twitter is blatantly censoring counter-narrative messages with the ""sensitive"" label"
839,"Witcher Netflix Show Looks To Cast BAME Ciri, And Fans Have Had Enoug…"
840,Patreon Staff Change Rules to Justify Banning Free Speech YouTuber
841,[humor] despite negative press Far Cry 5 is now the second largest ubisoft launch - almost as if game journalists have no audience
842,Man and woman arrested in UK for on suspicion of racial hatred (hate speech) for posting video of them burning the Koran.
843,"Student radio hosts yanked from air and have show suspended for saying 'tranny’. Station manager brings campus police, ""You are breaking the law""."
844,"I have no words, Star Wars is dead"
845,Male college student denied access to classes and education because his resemblance to someone else was too triggering for another student
846,Submitted my film to Sundance. Looks like I have no chance before the judges even see it.
847,"Former Female Assassin’s Creed Dev has ""internalised misogyny"" and ""condones"" attacks on females in the industry for saying ""stop bitching and complaining"""
848,"BREAKING NEWS. Another good man, a pillar of the comic industry, has passed away. Rest in piece, Stan Lee."
849,"American McGee: ""I'm confused by Twitter today. Is #gamergate being resurrected so gamers can all be called Nazis again? Didn't we clear that level already?"""
850,"BLM Leader arrested for human trafficking and prostitution, blames ""conservative trolls""; Interesting that many news sources seem to be ignoring this."
851,Mario and Luigi are appropriating Italian culture.
852,Reddit's most popular subreddit /r/funny just went private! Could this be the tipping point?
853,"Notch has hit minimum give-a-fuck: Called a dick by Margaret Pless, calls her a cunt in response."
854,"David Pakman on Twitter: ""Overnight, received many emails saying if I don't apologize for neutrality on #gamergate, I'm guilty of leading a hate mob against women"""
855,"Count Dankula: ""I don't think the media should be going after Jordan Peterson's fans. Peterson had a reasoned debate, whereas the media outright smeared me and sent a fuck ton of hate my way and caused me to get fired from jobs. Go fuck yourself hypocrites."""
856,"The Verge review of Read Dead Redemption 2 - ""Game is less successful when it comes to its treatment of women. Mostly relegated to side roles, like mothers, lovers, and caregivers."""
857,"[SocJus] This is how fast the SJW narrative spreads now: The demonstrably bullshit lie about ""Pepe is a Neonazi"" is already being taught in high schools."
858,I'll fight on your behalf.
859,[Humor] It's Spreading.
860,"Leigh Alexander seems to be trying to move on and pretend like her bad behavior wasn't exposed, so in honor of GDC here is a collage of her ""best"" tweets. including doxing, trying to ruin careers, racism...."
861,Patreon for doxxing twitter account @YesYoureRacist shut down
862,"Alberta University President David Turpin: Statements like ""it’s okay to be white"" will not be tolerated"
863,[Humor] A halloween costume idea for scaring the shit out of SJWs
864,[SocJus] Sargon’s Wikipedia page has been further edited to imply that the vidcon incident last year was “targeted harassment”
865,[Drama] Rick & Morty Creator is also sick of your SJW shit. Another reason to love the best cartoon on television!
866,"PC Gamer: ""Games seem to have become the latest target in a succession of empty moral panics staffed by pundits who have never touched a controller, yet feel comfortable publicly damning an entire creative medium from a position of barefaced ignorance."""
867,Nick Monroe seems to have discovered that it was Mastercard that forced Paypal / Patreon to ban Sargon - and deplatformed SubscribeStar for refusing to.
868,"[Ethics] NBC smears Jordan Peterson in ""alt-right"" propaganda hit piece. 57 likes, 7.7k dislikes show the public is having none of it."
869,"RECORDING: A department chair of a public university threatened me with removal for saying ""I don't think highly of Islam."" Recently this was taken down from YouTube via a privacy complaint from the professor."
870,"Strange how Laura Kate Dale is upset by Steven Universe being censored, when she was coercing a dev into censoring his a game a few weeks ago."
871,"BLM snowflake makes Orlando shooting about her at vigil, white gays are segregated at the event"
872,"""My dudebro Xbox alien shooting game is actual a deep political allegory"""
873,Since you are now banned from using MagicTCG if you post on KiA. We made a new Magic The Gathering subreddit.
874,"7 years ago, Spez edits a user's post title (x-post from /r/The_Donald)"
875,"Forbes writer upset that women-only screening of Wonder Woman wasn't ""met with lots of head-nodding and polite applause"", calls dissenters ""a bunch of Very Angry Men"""
876,"[SocJus] State Street, the firm behind the Wall Street 'Fearless Girl' statue, is paying a 5$ million dollar settlement for a lawsuit alleging discriminatory pay against women and minorities"
877,Polygon writer going full Polygon during Orlando shooting. [Ethics]
878,"[Humor] This has probably been posted before but given the ongoing DOAX3 fiasco, it's very much relevant."
879,Sky News (UK) splices interview video with Tommy Robinson -- Tommy secretly recorded the entire interview and proved that they straight up lied in their article
880,"[Opinion] The College Fix - ""Mizzou’s Melissa Click says she feared student journalist had a gun"" (lies about concealed carry law, which was introduced *after* the incident)"
881,Graphic Revealing Patreon Abuse - New Draft based on your help and feedback
882,[Humor] The Incredible Feminist Woman gets an urgent call from Cologne
883,"GamerGhazi's newest moderator, colbyklaus, is actually notorious doxer lifestyled, who targeted pro-GG developers"
884,"[Twitter Bullshit] Richard Lewis posted evidence that Erin Biba has a history of hostility and insults towards Elon Musk on Twitter, prior to her writing her hitpiece on him"
885,Ohio Attorney: Brianna Wu 'Wasted Time and Resources' over #GamerGate
886,"If we don't like it, it doesn't have the right to exist"
887,"[UPDATE] University of York puts out statement that, after cancelling a men's issues awareness event due to complaints from SJWs, its ""gender equality"" programs will now focus exclusively on women's issues"
888,"Riot at PAX WEST discriminating against men for some of their panels, presentations such as ""Narrative Writing"" and ""Game Design"" will only be available to non-binary and women."
889,"[SocJus] SJWs do everything they can to disrupt James Damore and Heather Heying, former Biology professor at Evergreen and Brett Weinstein's wife, at Portland State University. Include ripping out cables and yelling that ""Nazis aren't welcome in civil society."""
890,[Humor] PewDiePie is having issues with the YouTube review system. Count Dankula responded to it.
891,"""[Feminists] did it to scientists, they did it to sports - the Gamers were the first group...that really fought back...they like to win...they were not the right group to pick a fight with"" - Christina Hoff Sommers"
892,Yo. Legal update.
893,"Looks like SJW have a new propaganda effort going: ""Banning hate subreddits stops hate on Reddit"" of course the study doesn't define ""hate speech"" and it's own claims don't back what it's saying. But I'm sure this will be used to justify removing wrongthink from Reddit."
894,"Feminist Frequency met with Sledgehammer games back in 2015, and now there's black female Nazis in Call of Duty: WWII."
895,"[SocJus] Polygon's double standards in regards to censorship - written by the same author, no less."
896,Total Biscuit Nukes Leigh Alexander from Orbit After she Goes After Ken Levine
897,"[Industry] Former college athletes win 60 million dollar lawsuit against Electronic Arts and the NCAA. For years, EA and the NCAA used their likenesses without compensation in Electronic Art's popular series of NCAA video games."
898,"That moment when YouTube includes Franchesca Ramsey from MTV Decoded in their team of ""Ambassadors"" to tackle social issues. You can't make this up!"
899,"Former CoD dev: ""one time I killed a dog in-game for a media demo and Kotaku's headline was 'Infinity Ward Hates Puppies'"""
900,Gregory Alan Elliott has been on trial for 3 years because he disagreed with feminists on the internet. I'm coordinating the #FreedomOfTweets campaign to support his legal fund.
901,"[Ethics] Al Jazeera accuses TIM POOL of all people of being a ""white supremacist"""
902,[SocJus] Why most video game characters are male
903,"[SocJus] Based Mom - ""Received sad not(e) from a dad whose daughter is a campus gender warrior. He sent her my videos. Her reply: Do this again & I'll cut all contact."""
904,Jordan Peterson Interviews James Damore about his Google Memo on Diversity
905,"NY Politician Who Proposes Mandatory Social Media Searches as a Precondition to Firearms Ownership Tweets ""Kill Yourself"" When Confronted With Misuse of Parking Placard"
906,Baldur's Gate's SJW-heavy expansion is being panned by fans on GOG and Steam. The devs' response? Begging their fans for positive reviews. Pathetic.
907,Elon Musk is destroying dishonest media hacks again. Takes on the 'sexism' and 'harassment' narrative while taking no prisoners [Humor]
908,"CNN Caught on Tape telling ""unbiased"" debate watchers what answers to give."
909,"[Drama] Laci Green - ""Vox has been publishing slander and lies about me since i started debating conservatives a year ago. part of me wants to seek out legal counsel and see if there’s anything i can do to hold them accounrable. but part of me is also lazy and apathetic. what do you guys think?"""
910,Petition to Repeal the Linux Foundation's New Code of Conduct
911,"Sanity Sunday about the good, real, strong women"
912,"Netflix The Witcher's writer Beau DeMayo on why it is not okay to erase ethnicity of the The Black Panther, but super ok to do that to characters of The Witcher"
913,"Luke O'Brien (Huffington Post) has just doxxed a Jewish woman for expressing views he did not like, and gotten her husband fired [Ethics]"
914,"The #1 most upvoted post here, about Kotaku, RPS, and polygon not reporting on the Kingdom Come: Deliverance alpha, is heavily misleading at best. We would be PISSED with misinformation or 'reporting' like that elsewhere, so why support it here? We're better than that."
915,"[Censorship] NeoGAF bans discussion of Huniepop 2 after being triggered by ""clear racism included in the game and the elevated bigotry"", and not wanting to ""give this game or its creator any further visibility."" (nexus of 'hardcore gamers' folks)"
916,Canada: SJW judge reduces sentence for abuser of 5-year-old girl because of his race [SocJus]
917,[Humor] Official Sonic Twitter account mocks SJWs.
918,Demographic study: Kotaku has a worse gender representation than every game and company it has criticized for poor gender representation
919,[Censorship] Spain is probably going to aprove an insane law that gives lgbt groups power to censor and revert burden of proof
920,CISA Is Now The Law: How Congress Quietly Passed The Second Patriot Act
921,"Tim Pool: ""If Twitter is going to ban or suspend people then I ask that they be consistent. Ban everyone or ban no one. There have been numerous instances where conservatives have parroted statements by progressives and gotten suspended while the originals remain live."""
922,Harassment now includes liking a woman's tweets while male [TWITTER BULLSHIT]
923,"Women's issues 'experts' declare that the US is the tenth most dangerous country in the world for women. Worse than Pakistan, South Africa and perhaps the Congo on rape [Humor]"
924,"""Safe Space"" Students Silence Asian Woman For Saying ""Black People Can Be Racist"""
925,"Woman screams about ""White Fuckers"" while calling others racist. Her supporters defend her to the end. This is the kind of hypocritical culture that I hope we stand against."
926,"Mods subtly remove ""Mansplaining"" video on /r/cringe"
927,"[Ethics]/[Opinion] Allum Bokhari: ""The New York Times fired a very good tech journalist, Quinn Norton, because she associated with weev (while strongly disagreeing with him)....But they hired Sarah Jeong, an unapologetic racist."""
928,Mombot demonstrates the sheer level of absurdity going on at Polygon through a simple screenshot of the Editor-in-Chief's Twitter
929,Drexel University Professor's Christmas Wish: 'All I Want for Christmas is White Genocide'
930,"Pewdiepie, don't raise your arm"
931,[Censorship] DeviantArt apparently banned Kukuruyo's art mocking Feminist Frequency
932,"That's an odd way of spelling ""Gawker posted an illegally obtained celebrity sex tape and rightfully got sued into oblivion for it."""
933,FBI now investigating the black clothed rioters that were in UC Berkeley during Milo event
934,Destiny wants to automatically-DMCA every archived link posted here
935,"[censorship] Less than a day after Lauren Southern's Facebook suspension ends, they suspend her YET AGAIN for saying illegal immigrants should be deported"
936,Based Sargon explains why SJW's are obsessed with video games being ''mature'' and ''growing up''
937,Probably a repost: This 4chan user neatly encapsulates most of what were up against.
938,University of Missouri Hunger-Striker Who Protested 'White Privilege' is the Son of a Millionaire Railroad Executive
939,[Twitter Bullshit] So apparently we're responsible for the Limo being set on fire in Washington DC now lol
940,"Brianna Wu claims that DeepFreeze ""goes disproportionately after women journalists"", even though out of the 218 journalists listed, only 31 (14%) are female."
941,"[Happenings] So, Milo from Breitbart posted this Journalist request over at Twitter about Sarah Nyberg o_O"
942,Salon isn't clear whether the Orlando shooter was a terrorist or not... but knows that GamerGate people definitely are.
943,CERN suspends professor after saying men are discriminated against in STEM fields
944,"[Misc.] Some good news - TotalBiscuit is doing better. ""Tumor markers down more than 75%. This little bitch picked a fight with the wrong man """
945,"Norwegian gamer site (One of the biggest in Norway) releases article about how they are being ""strangled"" by being forced to sign confidentiality agreements regarding game reviews and calls for better ethics in the game journalism community and to put the consumer first."
946,"So now GamerGate is being mentioned in the same breath as the United Nations, and apparently KIA is at the forefront of stopping unnecessary government overhaul of internet protocol. What in the actual fuck? I literally cannot believe it."
947,Wired posts gushing article about Zoe Quinn's new book with apparent undisclosed affiliate link.
948,[CENSORSHIP] Proof Twitter is Ghost-Deleting Tweets it Doesn't Agree With
949,"Turns out it's usual for Nathan Grayson to cover his friends' work, including 5 mentions of his friend Robin Arnott's game and coverage of GaymerX while going out with its president. No disclaimer in any of those articles"
950,SJWs are already blaming misogyny for blowback against Diablo Immortal
951,[SocJus] Radical Fascist Protest Leader Yvette Felarca Goes on Tucker and Lies Through Her Teeth About Milo and the Protest in Sacramento
952,"Just a thought - I am a white male who has never said or done anything racist, homophobic or sexist. Yet feminists and SJWs continue to bash things I enjoy and harass my lifestyle."
953,"[Opinion] Here is a letter from my near 100-year-old great grandmother who wants to say something to all of us about censorship, so I agreed to translate it for her. If you have time, please read it."
954,[Censorship] Anita Sarkeesian's fans try to get Thunderf00t fired and report him to the police
955,"Hey David, there is no ""silent majority"", do you even know how reddit works?"
956,"Jordan B Peterson: ""Those who consider themselves my enemies have been posting these all around my home neighbourhood."""
957,"Fucking hell, Google..."
958,THE BIG ONE: 100K GET
959,CNN trying to shut down livestreaming competition illegally. WeAreChange hit with DMCA when they are using CSPAN footage of State of the Union.
960,"CNN blames lack of Twitter growth on harassment, mentions Reddit has similar issue. (Reddit's had huge surge in popularity last few months)"
961,[Socjus] College ‘Diversity Council’ Admits to Posting Fake Racist Flyers On Campus
962,"""That's Not True"" BBC Host Hangs Up On Guest for Citing Rotherham Muslim Rape Scandal"
963,"[People] Exclusive - Mark Bernstein, Wikipedian Behind Biased GamerGate Article, Who Tried to Link GamerGate to Charleston Shootings - Caught Red Handed Editing Own Business, Product Wikipedia Pages. New Article - Improper - at Matthew Hopkins News"
964,"[Twitter Bullshit] ""Zoe Quinn is one of the most critically acclaimed, widely recognized indie developers in the gaming industry..."" Da Fuq?"
965,"Marvel pandering to SJW's was all for nothing. Now they are calling for a boycott. Peter Coffin: ""You should not give a cent to anything Marvel until their racist, Trump supporting CEO steps down."""
966,"Game developer George Broussard (Co-founder of 3DRealms and Apogee, Duke Nukem): ""I look forward to Polygon’s Fallout 4 preview where they send someone who hates RPGs, Fallout, and dogs."""
967,"Reminder: TotalBiscuit is not 'pro GamerGate', respect his wishes to distance himself."
968,"[Humor] Game Journalist: ""Game journalists have long been accused of hating games. I don't hate games, just the people who make, buy and play them."""
969,So they caught the person responsible for threatening blacks on twitter at Kean university rally....
970,"[SocJus] Gizmodo, in their William Shatner hitpiece, used a screencap of him wearing a nazi uniform (from an ST episode) as the lead image to poison the well (Shatner is Jewish)"
971,"[Censorship] /r/politics censored Milo's CNBC alt-right interview by claiming it was already submitted... 6 months ago, and linking to an Obama video"
972,"[SocJus] Study accusing people of unconscious racism hits frontpage of /r/science, mass removal of comments opposing such study follows."
973,College is the last place that should be a ‘safe space': A voice of protest against student protests
974,CNN ratings plummeted minus 48 % in just 1 yr
975,"Ben Garrison's latest cartoon, SJW University. Perfectly sums up how many SJW Universities function"
976,Students Yell and Jeer at Christina Hoff Sommers throughout Oberlin Talk (compare with the horrible harassment of Honey Badgers asking a polite question)
977,"""Attack Helicopter Dating Simulator"" dev's based response to #triggered snowflake complaining about the game's advertising on Steam"
978,Luke Plunkett from Kotaku wrecked by a reader in his gender-neutral Zelda article
979,Blizzard apparently keeps re-uploading the trailer to their new mobile Diablo garbage and changing the link in their launcher to hide the dislikes the original trailer got... (original trailer currently at 5k likes vs 150k dislikes)
980,[Ethics] Samantha Bee's show portrays Kyle Foley's friend as having 'nazi hair' - turns out that the dude is going through chemo...
981,Animator on Battlefield V straw mans a fan on twitter as both racist and sexist for asking if DICE can include a checkbox that disables custom character models
982,"Exposing the Democratic Party makes Wikileaks an alt-right gamer MRA! Welcome, Assange, you shitlord!"
983,[humor] Anita pulls out of SXSW without even being invited? I think there's a new government program in the works...
984,"Eurogamer asking the big questions about Cyberpunk 2077. Including being gay, gender fluidity and pronouns. Dedicates nearly half the interview to this."
985,[Censorship] r/WorldNews deletes a perfectly reasonably comment that was gilded twice because it went against the agenda
986,"[SocJus] When BLM finally decides to denounce people among their ranks, it's over having a BBQ with police"
987,"TotalBiscuit on Twitter: ""I am very much fucking done with pretending that Brianna Wu has anything worthwhile to say and is not a colossal attention-seeking hypocrite"""
988,Veteran gay rights campaigner Peter Tatchell is branded racist and transphobic by anti-free speech zealot who refuses to share stage with him at university debate
989,"Former Prime Minister of Canada: ""If you never encounter anything in your community that offends you, your not living in a free society"""
990,[Humor] GREAT SCOTT!
991,BuzzFeed removes negative story about a product once they become advertisers
992,Subnautica Dev Fired Over 'Hateful' Statements - A reminder that Game Journalism is fine with letting online groups get a game dev fired as long as they don't like the game dev in question
993,"Youtube's ""justification"" for banning Shirrako... absolutely ridiculous!"
994,"The narrative is shifting from ""doxing is wrong, period"" to ""but it's okay if it's to expose a racist or sexist."""
995,[Censorship] Reddit mods are censoring /r/The_Donald from posting about the censorship in /r/politics
996,"Reddit is continuing to quarantine Subreddits one by one, but because there are no announcements, it is unknown to many."
997,By far my favorite statement about KIA: user explains how he first heard about Cologne sex assaults [Meta]
998,Even Lowtax is getting tired of feminists. [Humor/Drama]
999,
1000,
1001,
1002,
1003,
1004,
1005,
1006,
1007,
1008,
1009,
1010,
1011,
