,0
0,[Humor] There's two kinds of people...
1,Reddit bans r/whalewatching thinking its a clone of r/fatpeoplehate. It was actually a real attempt at a whale watching community and has existed for +2 years.
2,[CENSORSHIP] The new age of reddit has begun. Admins ban /r/FatPeopleHate (and 4 other subreddits that the admins fail to disclose).
3,Pussy Pass Denied mods are being threatened with doxxing if they don't hand over the sub over to SJWs to shut down. One mod has already lost their job.
4,[Censorship]Youtube cuts ad revenue for Phillip Defranco for posting Annaliese Nielsen video
5,"Ellen Pao to NYT: ""the most virulent detractors on the site are a vocal minority, and that the vast majority of Reddit users are uninterested in what unfolded over the past 48 hours."""
6,[CENSORSHIP] Admins caught editing posts in /r/The_Donald
7,CNN discovers more evidence of Russian hacking
8,Cyanide & Happiness animator nails the Fine Bros drama
9,Delta Airline confirms that Adam Saleh was not kicked off a flight for speaking Arabic. He was kicked out for shouting and bothering passengers. The media owes Delta an apology
10,"100,000 people have now signed the change.org petition, requesting that Ellen ""From my cold, dead hands"" Pao step down as CEO of Reddit Inc."
11,"Yale girl who screamed at professor, ""who the fuck hired you!?"" served on search committee that hired professor."
12,Ashley Lynch can dish it but can't take it
13,"reddit hard bans all OP links to slimgur, the image host announced recently as a competitor to imgur due to imgur's political/ideological censorship of fat criticism images. imgur and reddit have common investors."
14,"[humor] there is an extension that just came out that changes the word white to black. i installed it and looked up the usual suspects (Salon, Gawker, HuffPo) it really shows you how fucked up their articles are and is really funny"
15,"Chairman Pao just banned /r/fatpersonhate and /r/fatpeoplehate3 for ""ban evasion"" - as if they were already ""harassing"", ergo: banning ideas instead of behavior!"
16,"Ken Bone, the media's victim of the week, once posted this to a rape victim. This is the man the media chose to turn into a monster."
17,"User banned from /r/Planetside after using a meme which involved the word ""trap"" and is forced to submit a 500 line of text essay on the impact of transphobia in America in order for the ban to be lifted."
18,/r/all : I encourage you to unsubscribe from /r/news
19,"To protest recent CEO/admin decisions following many years of CEO/admin mismanagement, July 10 has been suggested as a no reddit day. Find the details at /r/justsaynope."
20,"Girl from my University claims to have been attacked by 2 white male trump Supporters, caused alot of local outrage. Later admits she made it up"
21,Wikileaks bringing the salt burn
22,Congress confirms Reddit admins were trying to hide evidence of email tampering during Clinton trial.
23,"Facebook declares Wikileaks links ""unsafe"""
24,"A joke making fun of Reddit CEO Ellen Pao is removed for ""harassment"" after receiving more than 3000 upvotes."
25,Black female student caught faking racism by creating KKK Twitter account and threatening black students
26,[Censorship] r/neogafinaction has just been banned. The sub didn't break any rules and was unrelated to neofag. Yet Admins banned it because it was critical of anti-GG forum neogaf
27,"Gawker might have died, but its legacy lives on. The media's hate continues."
28,"Two identical tweets were posted on Twitter. One with ""I fucking hate white people"" and another changing white to black. Guess which account got suspended and which was ""not in violation of the community guidelines""?"
29,Maddox with a perfect response!
30,"Voat.co's provider, hosteurope.de, shuts down voat's servers due to ""political incorrectness"""
31,A simple test of Twitter's culture
32,The value of capturing SJW insanity on camera cannot be understated: that Lyft driver with the Hawaiian bobblehead got fired for a few days before Annaliese's video proved him innocent.
33,Video game designer Daniel Vávra is called racist by an SJW for not putting black people in a videogame about medieval Czech kingdom. Explains that this is because there were none. [X-post from /r/QuitYourBullshit]
34,Found this on /r/WTF
35,"This is going to rustle some asses. ""Ghostbusters"" has been nominated by the Razzies for ""Worst Screenplay"""
36,"I was shadowbanned after posting theories that the FPH banning was a testing ground for a new bot system that dismantles the Streisand effect to impress potential investors. No brigading, harassing, shitposts (well maybe some), or repeat spamming. More info in description..."
37,"Spotted at a bus stop near a Google office in California, Los Angelos. Holy moly"
38,Harry Potter author J.K. Rowling attempts to push the narrative that PewDiePie is anti-Semitic. Gets BTFO by her fans
39,An old Reddit admin speaks his mind.
40,"John Totalbiscuit Bain July 8, 1984 - May 24, 2018"
41,[CENSORSHIP] Removed comment on /r/movies explains why the Ghostbusters reviews are so positive
42,"Hey SJWs, the lead scenario designer for Final Fantasy XV is a woman. Is Final Fantasy XV still ""by guys, for guys?"""
43,"Ellen Pao is now retweeting Brianna Wu, it's ogre"
44,Hyper Realistic Drawing of the UN Speeches
45,"[Ethics] Actually, it's about ethics in ""celebrity nudes"" journalism..."
46,"Laci Green: ""dear ny times, please do not compare men as a whole to the harvey weinsteins and bill cosbys of the world ever again. just because your writers are rape-sympathizing creeps doesn't mean all men are. thx bye."""
47,"r/news locks thread about orlando night club shooting (20+ killed) when live FBI/Police interview reveals strong possibility of terrorist attack/extremist link, shooter had bomb vest, explosive devices and is not from the area/may be of middle eastern appearance etc."
48,"[Happenings?] Three subreddits have gone private - /r/gaming, /r/science, and /r/IAMA"
49,"[Discussion] Whatever you think of the election results, one thing is clear: the MSM has suffered a crushing defeat"
50,News articles on the Ellen Pao $276k legal fee news item were deleted at least 15 times on reddit. Most deletions were on default subreddits. (Archive from /r/undelete)
51,"Reddit, then and now"
52,"[Drama] Comedian Sky Williams eviscerates MTV's (frankly) racist video giving ""advice"" for New Years' Resolutions to white men. MTV has hit a disgusting new low."
53,"Huffington Post makes a fool out of itself, again"
54,Free Speech at Berkeley: 1964 vs 2017
55,"[Humor] Notch on Twitter: ""lol gawker. I'm sorry to everyone losing their jobs, but as long as you can't play games, I'm sure Polygon is hiring."""
56,Netflix's trailer for Dear White People has reached over 50 thousand dislikes in less than 24 hours. This is what happens when you pull an MTV
57,"Reddit has let go /u/kickme444, the founder and operator of RedditGifts"
58,[Notch] Need to squirt water on SJWs so they learn not to piss inside
59,"FPH mods enforced np link standard & brigading/harassment site rules. No presented evidence so-far shows the FPH sub uniquely violating any rules, unless 90% of subreddits are also in violation. Meanwhile, SRS permits non-np links, which is an ACTION that has been used to partly justify FPH's ban."
60,[Twitter bullshit] SocJus lost in action
61,[Humor] CNN uses Fallout 3 Hacking screen in segment about Russian Hacking.
62,"[CENSORSHIP] Imgur censors the word ""Trigglypuff"" after a new video by a person who was attending ""The Triggering"" talk (featuring Milo, Based Mom, and Crowder) goes viral on Imgur"
63,Male body shaming is okay
64,[SocJus] Lawsuit: Yahoo CEO Marissa Mayer led illegal purge of male workers
65,"CNN producers and high ups caught on tape admiting that ""Russia story"" is about ratings and agenda, not journalism"
66,"[Opinion] Notch: ""The narrative that words hold power got internalized so hard people are confused why shouting words isn't changing reality."""
67,"this picture was removed from r/funny for harrasment, it sums up the recent pao events nicely in my opinion"
68,"Jessica Valenti dishes it out but can't take it. She's fine with a President-elect's daughter getting verbally berated on a plane, but someone in a car is rude to her it gets an entire column about how she was ""harassed."""
69,Pepe The Frog is ranked #1 in Time's fictional character of the year magazine. It's fucking happening
70,"BBC refused to report on the death of Jay Cheshire, the victim of false rape allegations who's mother has now also taken her her own life because she ‘couldn’t see a future without him’"
71,Hull university Student's union giving free lessons in Irony.
72,"Woman screams at Reporter to leave because he is a ""fucking white male"". Isn't it sad that this considered fairly normal now?"
73,"[SocJus] The naked truth about ""Rape culture"""
74,Why we need 4th wave feminism
75,"@Notch refers to Kotaku as ""the Fox News of gaming"""
76,"In case it wasn't obvious, KiA stands with the subs that are participating in the blackout."
77,"[Censorship] r/Politics bans video of CNN feeding lines to ""focus group"" due to it being ""out of date"" despite it being less then 24 hours after incident"
78,"TIL ""Buddy"" Fletcher, Husband of our own Reddit CEO (See comments), is being accused of operating of Ponzi scheme. According to the Chapter 11 trustee his now bankrupt firm committed fraud against investors, including three Louisiana government pension funds that lost $144 million(Deleted from TIL)"
79,[Censorship] Mod of r/neofag shadowbanned for asking new CEO if neofag could be unbanned because we never harassed anyone on Reddit.
80,[Humor] Notch is not meeting someone's expectations (x-post r/rickandmorty)
81,John Cleese will no longer perform at University campuses as political correctness kills comedy
82,SalonInAction
83,"I wish I was a female celeb in gaming sometimes...(nude pictures incorporated onto CSS of subreddit, hosted on reddit servers, admins didn't really seem to care)"
84,"CNN, Time and Slate ask the public who won a presidential debate, all polls show similar results from the public, but all three outlets choose to go with their own version of reality"
85,Based College student gloriously trolls Laci Green and shows Laci Green's true colors to everyone
86,"Empty theaters in Ghostbusters opening week, attacking your main audience with vile insults doesn't seem to be a good marketing strategy after all."
87,Courtesy of Tomi Lahren and Trevor Noah: an example of actual tolerance and civility in the media.
88,"Notch: ""[An SJW is anyone] who believes personal feelings are worth defending more than personal liberties."""
89,"Amy Schumer wants equal pay from Netflix after finding out male comedians earn more. She thinks it's because she's a woman, not because she isn't funny."
90,"Marchers in Berkeley demand ""no pictures"" from the press covering the event."
91,"Petition for Pao to step down hits 200,000 signatures"
92,"Reddit's CEO in 2012: ""We stand for free speech... we are not going to ban distasteful subreddits."
93,I don't think that word means what she thinks it means.
94,"The admins have suspended /u/AntiHateBrigadingBot, the bot that notifies people when a post or comment is linked to SRS."
95,Adam Saleh says he was arrested at the airport for speaking Arabic on the phone with his mother. Adam Saleh has a history of disturbing airline flights and has been arrested for doing so. Don't fall for this story being spread by mainstream media
96,"[Censorship]The first of the major content creators closes shop. Creator of /r/crappydesign shuts it down permenantly, and steps down as moderator of /r/Art"
97,TotalBiscuit needs our well wishes and prayers.
98,"Ellen Pao posted a link to a private message to /r/FaithInHumanity (that nobody except her could read, obviously), gave herself gold for it, got mercilessly mocked in the comments, and shadowbanned almost everyone who commented."
99,"Hillary Clinton Secretly Enlisted Feminist Writer Jessica Valenti to Brand Bernie Sanders as ""Anti-Woman"""
100,"Jennifer D'aww: ""I've received more threats in the past year from SJWs than in the 13 yrs as a female dev from any male gamer."""
101,"Twitter staff side with Izzy, who lied about Sarah's chat logs to cover up pedophilia [PUSH THIS SHIT FOR ALL IT'S WORTH]"
102,"Wikileaks goes hard against SJWs ""Generation trauma: The rise of ''trigger warnings', 'microaggressions' & 'safe spaces', the generation trauma fad is pro-censorship which impedes our work."""
103,/u/spez all but confirms that SRS is an exception to the rules and will not be banned.
104,Porn Site Offers Gawker Founder $35k To Star In Hulk Hogan Themed Porn Film
105,"Do you know why Reddit banned you from coordinating e-mail campaigns? BECAUSE IT WORKED. Chairman Pao won't let you do it, but you can use Voat to go after Reddit, Conde Nast, Vox Media, and Gawker as ruthlessly as possible."
106,"[Notch] ""Spoiler: the obvious false narrative about @pewdiepie is not an isolated example."" ""burn it all. no mercy. no compromise."""
107,[Humor] Just Pewdiepie's updated twitter banner.
108,"I never in my 21 years thought I'd say this, but Brianna Wu has a valid point."
109,"As Ken Bone enjoys his 15 minutes, SJW's sift through his Reddit history in an attempt to ruin his life."
110,"The woman who started ShirtStorm was invited to talk at Google Ideas about ""Fighting Online Abuse."""
111,Cosmopolitan lies about a Sikh taxi driver being Muslim for propaganda purposes. Gets called out by Sikh Press Association. [Ethics]
112,The difference between an SJW and an activist
113,I can think of literally nothing more privileged than being able to ask the UN to stop people from making fun of you on the internet.
114,[Humor] How a mod team should respond to censorship requests
115,This is up at my university. Because teaching students that it's guilty before proven innocent is a priority.
116,"#BlackLivesMatter supporter threatens woman's property with violence for supporting Trump, 16k retweets later ""safety council"" no where to be found."
117,The guy who wrote the WSJ article accusing Pewdiepie of Anti-Semitism tweeted a Holocaust joke
118,"[Happenings] ""Judge Campbell denies Gawker's motion for a new trial. She will not reduce the $140m damages at all. #hulkvsgawk"""
119,"Pepe the Frog's creator threatens to sue anyone who uses Pepe and ""Altright"", including Reddit if it doesn't force /r/The_Donald to censor Pepe"
120,"Famous Harvard professor rips into 'tyrannical' student protesters, saying they want 'superficial diversity'"
121,"""You know you've won the argument when the only counter argument they can find is that you are white or male or old."" - Richard Dawkins"
122,[Humor] How the world would react if Disney had released 'Aladdin' in 2017 (x-post /r/funny)
123,"Anita Sarkeesian is caught lying again, this time about a lack of snow jackets in the Tomb Raider series (there are five games in which you can wear these)"
124,"[Gaming] Ubisoft mocks Christianity in Watch Dogs 2, but when one user of the Ubisoft Forums asks if they would do the same thing with Islam, the thread gets locked immediately for being ""offensive to religions"""
125,"Tyler Wilde, the PC Gamer writer who compared the ""PC masterrace"" label to Nazism, wrote a big number of articles about Ubisoft games, while being in a relationship with Anne Marie Lewis, the Communications Associate at Ubisoft"
126,[Humor] The absolute horror
127,[CENSORSHIP] The person who asked Rev Jackson some harsh questions in his AMA has been shadowbanned.
128,"Too late, Salon"
129,"""Any man who must say 'I'm the king' is no true king""."
130,Buzzfeed editor says barring white people from a job on the basis of their skin color isn't racist.
131,Self-awareness reaches ZERO. Gawker says BLM shouldn't be blamed for the actions of a few and that it is not a formal group with entry requirements!
132,"[Socjus] RIP the Onion. After top Hilary donor buys it, this garbage is posted masquerading as humor."
133,"Gawker/Jezebel just outed a sex worker against her will, linking to her Instagram and revealing what she looks like and potentially opening her up to actual physical violence"
134,"Elon Musk: ""I use twitter for news orgs. My Insta has same women as men. What's up with the phoney PC police axe-grinding?"""
135,"Porn Star Riley Reid ""How ironic is it that an anti-bully profile is shaming me for doing porn. #goodjob"""
136,Woman who falsely claimed she had been raped so she could resit her A-levels is jailed for two years
137,Count Dankula has just been found guilty in his batshit trial
138,[News] Lena Dunham accuses NFL player of body shaming and sexism because he rejected/ignored her
139,"[Humor] ""social justice"" rape!"
140,"The people behind the study that said kids want less ""oversexualization in games"" (which turned out being a public SurveyMonkey poll distributed around feminist Facebook, Twitter and Tumblr pages) confirm they're NOT releasing their raw data"
141,Mod of /u/undelete creates bot to show you what reddit's front page looks like without moderator censorship.... over half of top links are removed.
142,"The Young Turks published a video titled ""Hey White Christians! Your Time Is Almost Up!"" and is allowed to be monetized."
143,Female officer refused to shoot African American criminal because she feared media backlash. Beaten nearly to death
144,[SocJus] SocJus warriors get upset and sad when their children are biologically normal human beings
145,CNN goes full retard. CNN and interviewee blame UC Berkeley rioters on conservatives pretending to be liberals
146,[Censorship] Youtube pulls all videos of Hillary's collapse at 9/11 memorial.
147,"I'M RACIST? | Pewdiepie mocks media outlets which called him racist after his ""YOUTUBE IS DELETING MY VIDEOS BECAUSE I'M WHITE"" joke"
148,Jury has reached a verdict in #HulkvsGawk
149,OH GOD I NEVER REALIZED HOW UNREALISTIC GAME CHARACTERS WERE
150,"Youtube has removed the video of students terrorizing Bret Weinstein for ""harassment and bullying"" - even though it included nothing other than the video students themselves had taken. I have the videos here for you. [Censorship]"
151,Reddit Mods Who Censored Rape Crisis In Europe Now Censoring Reports of Female Worker Murdered By Migrant At Refugee Center
152,"[X-Post /r/The_Donald] My uPlay Donald Trump avatar got suspended, really UbiSoft?"
153,[Censorship] /r/news locks rapidly rising thread about CNN's deceptive editing.
154,Cologne Sexual Assault Victim Called a Racist and Harassed After Identifying Her Attackers
155,"YouTube CEO Says Interrupting Her is ""Sexist Microaggression"""
156,"Does anyone else feel like we're stuck in the middle between extremists from both sides who have used social media to increase the effect of their voices and beliefs, who don't care to reason, and will never come to terms with each other?"
157,"World of Warcraft Lead Developer Mark Kern: ""Just wanted to thank the GAMES journalists who have demonized our hobby and our customers to the mass media."""
158,"Notch attacked on Twitter by crazy SJW, who then begs him for money."
159,"The Google Memo: Four Scientists Respond — ""The author of the Google essay on issues related to diversity gets nearly all of the science and its implications exactly right."""
160,"This story has been deleted by mods all over reddit. ""Cologne Police Chief Condemns Sex Assaults on New Year's Eve"""
161,"MAJOR Ellen Pao update. She admits to screening new Reddit employees for pro-socjus, removed salary negotiations because women can't negotiate."
162,"/r/news mod has mental breakdown, tells reddit users to kill themselves, then continues to delete threads and comments at full speed"
163,[Ethics] Ethan from H3H3Productions calls out The Wall Street Journal for taking PewDiePie's videos out of context and causing him to be dropped from Disney
164,"[SocJus] Chris Pratt Calls for More Movies About Blue Collar America, Author of the Article proceeds to call Pratt a Straight White Male, completely misrepresents what he says and turns it into a bullshit race-baiting argument against him."
165,This is the usual double standard that Gawker Media does. But this time Hogan stood strong and won 115 million $ in awesome lawsuit
166,Student has grade docked for using 'mankind' in English paper instead of a gender-neutral alternative
167,Another hate crime being spread by the media caught being faked. Muslim teenager claiming to have been attacked and left to die on a railway is now being charged by police for filling a false report
168,Notch saying the truth to a girl who complain about mansplaining on Twitter
169,"Went through all 120 citations in the UN Cyber Violence report. Worst sourcing I've ever seen. Full of blanks, fakes, plagiarism, even a person's hard drive."
170,[Humor] Zyklon Ben on Social Justice Warriors (drawn for Sargon) - I'll just leave this here...
171,"Tracer's new pose added to Overwatch. I am starting to think this was all an elaborate PR stunt now because, well, check dat booty."
172,By Patri-Archie Comics: how racism spans the political spectrum
173,ANTIFA group on Facebook posts someones home address and calls for an attack. Facebook says nothing is wrong
174,"[Drama] Cammy cosplayer forced to wear pants due to triggered Sjw's at today's CEO tourney in Orlando, Florida"
175,"Youtube has removed the orginal video of a white Trump supporter being tortured by blacks, due to ""policy on spam, deceptive practices, and scams"""
176,SJWs Bullied A Young Artist Into A Suicide Attempt... And They’re Still Telling Her To Kill Herself
177,[humor] Audi just accidentally debunked their own wage gap Super Bowl commercial in one tweet
178,Turns out Milo isn't gay after all [Humor]
179,"This patriot took down Gawker. Give it up, one more time, for a real American."
180,a food reviewer got invited to a pre-screening of GhostBusters and gave out a review despite embargo Watch it while its up
181,"[Censorship] In the aftermath of the FPH ban, let us remember that SRS doxxed Boogie2988, who is struggling with weight issues (But they did it from their IRC channel which apparently makes it okay)"
182,Getting hired at /r/news
183,"[Ethics] Salon blaming ""President Donald Trump"" for bombing hospitals in Syria when, ya know, Obama is the one still in charge and responsible for it."
184,"Hate-crime hoax ""Racist note"" shutdown the entire school for a day. The ""victim"" wrote the note to herself."
185,"[Twitter Bullshit] Twitter has suspended @SafeMov, a Saudi women's rights account"
186,"Wikileaks: ""There is presently a dangerous push to redefine insulting online speech as ""violence online"", which will mandate aggressive state censorship"""
187,[Discussion]Now you see why #GamerGate matters
188,Savage
189,"[Censorship] Apple Removes All American Civil War Games From the App Store ""...because it includes images of the confederate flag used in offensive and mean-spirited ways."""
190,[HUMOUR] Ben Garrison's latest comic touches on the recent Reddit badthink crackdown
191,"""It's okay when we do it."""
192,Pewdiepie's Response to the WSJ Controversy
193,"Drexel University responds to ""White Genocide"" tweet, calling it ""reprehensible"" and ""deeply disturbing"""
194,"[Censorship] r politics: ""We do not allow Wikileaks submissions"" - but Salon and Huffington post are fine."
195,"[Ethics] Vice journalist reveals Lena Dunham lied about voting for Clinton in primary, is fired for it"
196,"Milo Yiannopoulos event in UC Berkeley evacuated after protestors lit fires, threw rocks at attendees, and broke windows"
197,"Candace Owens was banned for 12 hours after replacing the word “White” with “jewish” in one of Sarah Jeong’s racist tweets, but Sarah Jeong’s account remains unbanned."
198,"Gawker fucks over some random guy by publishing his private info: ""The Apple Bug That Let Us Spy on a Total Stranger's iPhone"""
199,[Censorship] There's an AMA in /r/science right now which is meant for speaking about racial/gender discrimination. This was my comment that got removed.
200,"[Censorship] /r/Technology removes 7000+ upvoted top submission regarding Hillary Clinton's IT manager Paul Combetta due to ""not exact title""."
201,"/r/WorldNews mods censoring views as ""Hate Speech"""
202,Hey folks coming in from r/all - A CNN producer flat out admitted that they lie to the American public for profit. You don't get to ignore video documentation just because you don't like the people involved
203,"It's done. Laci Green's redpilling is officially complete. She now shares the one aspect that unites all GamerGaters, anti-SJWs, etc. Behold!"
204,"Edward Snowden on Twitter: ""No matter your opinion of @Wikileaks or Assange, censorship is never the answer."" (x-post /r/The_Donald)"
205,"Kickstarter community manager who praised Anita despite her never delivering turns out to be a racist: ""whiteness equals bad"", ""whites have the strangest rituals"", ""You know what's great about us? None of us are white"", ""is it wrong that i enjoy music videos that have 0 white people in them?"" +more"
206,"Polygon, Time, The Guardian, The Mary Sue and others run story on how a survey proves a majority of kid and teen gamers today think females are oversexualized in games. Survey was a public SurveyMonkey link posted on several SJW twitter pages like Ashly Burch's and feminist Facebook and Tumblr pages"
207,What the actual fuck.
208,"[Censorship] Voat is currently being hit by a DDoS, this is the second time in 24 hours."
209,Social Justice 101: Get violent and lie about it - Lauren Southern assaulted at free speech rally
210,"Boogie2988: ""If you ever wondered what it was like to watch Rome burn, just look at reddit, fiddle harder, ellen!"""
